จังหวัด,รายชื่อวัด
ชลบุรี,วัดแหลมฉบัง 
,วัดช่องลม
,วัดสัตหีบ
,วัดหนองขาม
,วัดน้อย
,วัดชลธีบุญญาวาส
,วัดเขาดินวนาราม
,วัดหนองสังข์ประชาบำรุง
,วัดราษฎร์สโมสร
,วัดอ่างศิลา
,วัดกลางคลองหลวง
,วัดมาบโป่ง
,วัดราษฎร์ศรัทธา
,วัดระเวิงรังสรรค์
,วัดศรีธรรมาราม
,วัดโพธิ์
,วัดบุญญฤทธยาราม
,วัดศรีวนาราม
,วัดหนองกระทุ่ม
,วัดคลองตะเคียน
,วัดเนินดินแดง
,วัดโคกพุทธา
,วัดหนองเกตุน้อย
,วัดบุญญาวาส
,วัดเจ็ดเนิน
,วัดคลองโค
,วัดอุทกเขปสีมาราม 
,วัดใหญ่อินทาราม
,วัดวิมลคุณาราม
,วัดนากระรอก
,วัดเขาดิน
,วัดหนองไผ่
,วัดสุทธาวาส
,วัดเขาไผ่
,วัดวรพรตสังฆาวาส
,วัดเขาเสาธงทอง
,วัดพุทธศาสตร์
,วัดทรงเมตตาวนาราม
,วัดยุคลราษฎร์สามัคคี
,วัดหนองฆ้อ
,วัดใต้ต้นลาน
,วัดสันติคีรี
,วัดกลาง
,วัดประชุมคงคา
,วัดหนองเม็ก
,วัดบุณย์กัญจนาราม
,วัดเกาะลอย
,วัดต้นกระรอก
,วัดบ้านงิ้ว
,วัดหน้าพระธาตุ
,วัดเขาบ่อกวางทอง
,วัดใหม่ทรายมูล
,วัดเขาบำเพ็ญบุญ
,วัดเขาคันธมาทน์
,วัดสังกะสี
,วัดช่องลมนาเกลือ
,วัดเนินสี่
,วัดแหลมแค
,วัดอัมพวัน
,วัดท้ายเชิด
,วัดเขามะกรูด
,วัดเลิศรัตนาราม
,วัดอรุณรังษี
,วัดเขาสามชั้น
,วัดดอนดำรงธรรม
,วัดวิเวการาม
,วัดบางละมุง
,วัดหนองยาง
,วัดศรีมหาราชา
,วัดบวรราษฎร์บำรุง
,วัดวังรีคีรีวันวนาราม
,วัดใหม่ท่าโพธิ์
,วัดศรีพุ่มโพธิ์
,วัดเขาใหญ่
,วัดท่าบุญมี
,วัดกลางทุมมาวาส
,วัดเขาไม้แดง
,วัดพานทอง
,วัดนามะตูม
,วัดโพธิทัตตาราม
,วัดบ้านบึง 
,วัดรังสีสุนทร
,วัดเขาแตงอ่อน
,วัดหนองคล้า
,วัดสุวรรณารัญญิกาวาส
,วัดเขาชก
,วัดธรรมสามัคคี
,วัดต้นสน
,วัดหนองกะขะ
,วัดทวนทอง
,วัดหนองงูเหลือม
,วัดหนองชันจันทนาราม
,วัดหนองกาน้ำ
,วัดราษฎร์สามัคคี
,วัดกำแพง
,วัดรังษีสุทธาวาส 
,วัดโคกท่าเจริญ
,วัดโคกขี้หนอน
,วัดตโปทาราม
,วัดบ้านศาลา
,วัดเขาแรต
,วัดหนองอ้อ
,วัดเฉลิมลาภ
,วัดเขามะกอก
,วัดสายวารี
,วัดอินทนาราม
,วัดเนินหลังเต่า
,วัดเนินตามาก
,วัดพันเสด็จใน
,วัดบึงบวรสถิตย์
,วัดเทพพุทธาราม
,วัดยางใหญ่
,วัดชากนิมิตวิทยา
,วัดเขาถ้ำ
,วัดเขาชีจรรย์
,วัดบ้านเก่า
,วัดเขาหินลาด
,วัดพิมพฤฒาราม
,วัดบ่อวิน
,วัดหนองยายบู่
,วัดพยอม
,วัดสันติคาม
,วัดเครือวัลย์
,วัดป่ายุบบุญญาราม
,วัดหนองเลง
,วัดเขาคันทรง
,วัดมโนรม
,วัดเนินตอง
,วัดใหม่เชิงเนิน
,วัดตาลล้อม
,วัดสังกะเปรียว
,วัดบ้านนา
,วัดเนินกระบก
,วัดหนองตำลึง
,วัดหลุมมะนาว
,วัดสุกรีย์บุญญาราม 
,วัดปาลิไลยวัน
,วัดบางเป้ง
,วัดถ้ำประทุน
,วัดกุฎโง้ง
,วัดอรัญญิกาวาส
,วัดโคกพระศิลาราม
,วัดทรงธรรม
,วัดหนองม่วงใหม่
,วัดเขาเชิงเทียนเทพาราม
,วัดนันทวัน
,วัดแปลงเกตุศรีนิคม
,วัดหนองแช่แว่น
,วัดเขาน้อยพัฒนาราม
,วัดบ่อทองราษฎร์บำรุง
,วัดเขาห้วยมะระ
,วัดโพธิสัมพันธ์
,วัดห้วยสูบ
,วัดคลองใหญ่สถิตยาราม
,วัดเขาดินร่มโพธิ์ทอง
,วัดเขาคีรีรมย์
,วัดช่องแสมสาร
,วัดแหลมทอง
,วัดหนองน้ำเขียว
,วัดนาเขื่อน
,วัดหลวงพรหมมาวาส
,วัดวังตะโก
,วัดนาลิกวนาราม
,วัดเกาะแก้วคลองหลวง
,วัดเนินสังข์สฤษฎาราม
,วัดเกษตรสุวรรณ
,วัดเทพบุตร
,วัดสระตาพรหม
,วัดแสนสุขสุทธิวราราม
,วัดนพทองดีศรีพฤฒาราม 
,วัดสำเภาทอง
,วัดทุ่งโปรง
,วัดเขาน้อยคีรีวัน
,วัดหมอนนาง
,วัดเขาโชคชัยวังทอง
,วัดพรประภานิมิต
,วัดเกาะจันทน์
,วัดจรูญราษฎร์
,วัดสายสุคนธ์
,วัดนาพร้าวเก่า
,วัดผาสุการาม
,วัดศรีรัตนาราม
,วัดใหม่เนินพยอม
,วัดคลองพลู
,วัดเนินสุทธาวาส
,วัดป่าโชติธรรม
,วัดบุญญราษี 
,วัดหัวถนน
,วัดสวนน้ำตก
,วัดป่าวชิรบรรพต
,วัดป่าสามัคคคีธรรมาวาส 
,วัดศรีประชาราม
,วัดเทพประสาท
,วัดแจ้งเจริญดอน
,วัดตาลดำผดุงราษฎร์
,วัดเขาโพธิ์ทอง
,วัดหงษานิตยาราม
,วัดเขาบางทราย
,วัดอุทยานนที
,วัดหนองชุมเห็ด
,วัดบ้านห้วยกรุ
,วัดปรกฟ้า
,วัดราษฎร์บำรุง
,วัดคลองพลู 
,วัดโกมุทรัตนาราม
,วัดภัททันตะอาสหภาราม
,วัดหนองเสม็ดสันติธรรมาราม
,วัดเขาตะแบก
,วัดสว่างอารมณ์
,วัดป่าอัมพวัน
,วัดหนองใหญ่
,วัดบุญสัมพันธ์
,วัดทุ่งศาลา
,วัดท่อใหญ่
,วัดหนองข่า
,วัดช่องมะเฟือง
,วัดหนองเขิน
,วัดหนองเกตุใหญ่
,วัดคลองตาเพชร
,วัดท้องคุ้ง
,วัดบางพระวรวิหาร
,วัดหนองไผ่แก้ว
,วัดพรหมรัตนาราม
,วัดศรีอรุณ
,วัดวังทองเจริญธรรม
,วัดมาบสามเกลียว
,วัดอัมพาราม
,วัดเกาะแก้วนครสวรรค์
,วัดชัยมงคล 
,วัดหนองแฟบ
,วัดบ้านช้าง
,วัดไพรประเสริฐราษฎร์บำรุง
,วัดหุบบอนวนาราม
,วัดสุรศักดิ์
,วัดเขาบางพระ
,วัดราษฎร์เรืองสุข
,วัดเขาห้ายอด
,วัดมาบฟักทอง
,วัดมาบไผ่
,วัดตระพังทอง
,วัดแก้วศิลาราม
,วัดอู่ตะเภา
,วัดอมพนม
,วัดโปร่งเกตุ
,วัดธาตุทอง
,วัดราษฎร์นิยมธรรม
,วัดสันติธาราวาส
,วัดเขาบุญมีดาราราม
,วัดวังหิน
,วัดใหม่เกตุงาม
,วัดลิงงอย
,วัดบางนาง
,วัดบ้านใหม่
,วัดหนองม่วงเก่า
,วัดเครือศรัทธาธรรม
,วัดญาณสังวรารามวรมหาวิหาร
,วัดใหม่พระยาทำ
,วัดเนินแร่
,วัดหนองเกตุ
,วัดใหม่สำราญ
,วัดหนองบอนบุญญาราม
,วัดเนินบุญญาราม 
,วัดเขาโป่งสะเก็ตพุฒาจารย์
,วัดสามัคคีบรรพต
,วัดศรีพโลทัย
,วัดใหม่นาวังหิน
,วัดเนินสัก
,วัดสำนักบก
,วัดกุณฑีธาร
,วัดแปลงกระถิน
,วัดคลองมะเดื่อ
,วัดป่าเขาพุวนาราม
,วัดตะเคียนคู่
,วัดสามัคคีประชาราม
,วัดเขาชีธรรมนิมิต
,วัดหนองขยาด
,วัดพันเสด็จนอก
,วัดถ้ำยายปริก
,วัดเขาไม้แก้ว
,วัดใหม่โคกเพลาะ
,วัดนอก
,วัดพุทธิวราราม
,วัดหนองไก่เถื่อน
,วัดอัมพวนาราม
,วัดทับเจริญ
,วัดใหม่อยู่สงัด
,วัดบ้านกลาง
,วัดทุ่งขวาง
,วัดโค้งดารา
,วัดสระลอย 
,วัดชุมแสงศรีวนาราม
,วัดเขาหาดทราย 
,วัดหนองศรีสงวน
,วัดสิงห์ทองพรหมาวาส
,วัดป่าแก้ว
,วัดเขาดินญาณนิมิต
,วัดท่ากระดาน
,วัดกะบกคู่
,วัดโป่งตามุข
,วัดเซิดสำราญ
,วัดจรุงปรีชาราม
,วัดเวฬุวนาราม
,วัดตะเคียนทอง
,วัดธรรมนิมิตต์
,วัดพระพุทธบาทเขานางนม
,วัดพลับ
,วัดสำนักขาม
,วัดหนองจับเต่า
,วัดอ้อมแก้ว
,วัดห้วยใหญ่
,วัดสมานราษฎร์
,วัดเสม็ด
,วัดยางเอน
,วัดบ้านไร่
,วัดสันติภักดิ์
,วัดหนองไทร
,วัดเจริญธรรม
,วัดถ้ำเขาชะอางค์โอน
,วัดอ่างกระพงศ์
,วัดจุกกะเฌอ
,วัดเขาชะอาง
,วัดปชานาถ
,วัดโคกพนมดี
,วัดเขาน้อย
,วัดนาจอมเทียน
,วัดไตรมุขชยาราม
,วัดนาพร้าว
,วัดเกาะโพธาวาส
,วัดเขาพุทธโคดม
,วัดพระประทานพร
,วัดศาลาแดง
,วัดคลองมือไทร
,วัดหนองปรือ
,วัดพรหมาวาส
,วัดหนองรี
,วัดหินกอง
,วัดบ้านในบน
,วัดโพธาราม
,วัดหนองบอนแดง
,วัดชากสมอ
,วัดจุฑาทิศธรรมสภารามวรวิหาร
,วัดถ้ำจรเข้
,วัดมาบคล้า
,วัดสว่างฟ้าพฤฒาราม
,วัดโป่งปากดง
,วัดดอนทอง
,วัดเนื่องจำนงค์
,วัดหนองใหญ่ศิริธรรม
,วัดแหลมประดู่
,วัดบางเสร่คงคาราม
,วัดป่ายุบ
,วัดทุ่งเหียง
,วัดแก้วน้อย
,วัดไร่หลักทอง
,วัดพรเพ็ญ
,วัดสำเภา
,วัดห้วยยาง
,วัดนิมมานราษฎร์บำรุง
,วัดห้วยปราบ
,วัดหน้าเขาบ่อยาง
,วัดเตาปูน
,วัดหนองกระดูกควาย
,วัดป่าสุทธิภาวัน
,วัดชมภูแก้ว
,วัดโบสถ์
,วัดพิบูลสัณหธรรม
,วัดหนองลำดวนพรมศรี
,วัดเขาช่องลม
,วัดเนินหิน
,วัดทับบริบูรณ์
