,วัดป่าดงเมย
,วัดหนองยาง
,วัดดอนรังกา
,วัดโนนเจริญ
,วัดนาแมด
,วัดบุญธิศาราม
,วัดบ้านเปือย(ป่าศรีนวล
,วัดพนานิวาส
,วัดบัวทอง
,วัดบ่อหวาย
,วัดพาราณสี
,วัดเทพา
,วัดป่าหนองจิก
,วัดไชยชนะ
,วัดราษฎร์สามัคคี
,วัดยุทธิการาม
,วัดท่าไห
,วัดคำสมิง
,วัดสระปทุม
,วัดบ้านแต้
,วัดหนองตอแก้ว
,วัดเกษตรพัฒนา
,วัดคำอ้อ
,วัดโซง
,วัดป่าดงเสาธง
,วัดพระบรมธาตุ
,วัดแก้งโพธิ์
,วัดบัวเจริญ
,วัดโนนสุขสันติ์
,วัดคำเม็ก
,วัดน้ำอ้อม
,วัดยางกระเดา
,วัดหนองมุก
,วัดใหม่ศรีทอง
,วัดหนองกอก
,วัดบ้านดอนผึ้ง(ดอนผึ้ง
,วัดแก่งสว่าง
,วัดศรีนวล
,วัดศรีประดู่วนาราม
,วัดบ้านทุ่ง
,วัดโนนหนองไฮ
,วัดบุรีรัฐ
,วัดโคกสะอาด
,วัดจอมศรีมณีวรรณ
,วัดบ้านกะแอก
,วัดนาเลิง
,วัดวรรณวารี
,วัดหมากมี่
,วัดห่องไผ่
,วัดสุวรรณาวาส
,วัดป่าดอนบาก
,วัดเสลาวาส
,วัดบ้านยาง
,วัดโนนนิวาส
,วัดป่าโนนก่อ
,วัดโนนแฝกใหญ่
,วัดแจ้ง
,วัดพรสวรรค์
,วัดสว่างดงเย็น
,วัดป่าภูธรวนาราม 
,วัดโนนใหญ่
,วัดหัวสะพาน
,วัดน้ำยืน
,วัดห้วยไผ่
,วัดโนนหล่อง
,วัดมะลิวัลย์
,วัดบ้านบัว
,วัดสว่างอารมย์
,วัดศรีบุญนาค
,วัดป่าภาวนาสามัคคี
,วัดถ้ำป่อง
,วัดบุ่งแก้ววงศ์ประดิษฐ์
,วัดป่าเก่าพระเจ้าใหญ่ 
,วัดตาโม
,วัดโนนดู่
,วัดร่องข่า
,วัดวังพระ
,วัดหนองโพด
,วัดโนนสูง
,วัดเหนือ
,วัดทุ่งคำไผ่
,วัดหนองดูน
,วัดดอนใหญ่
,วัดบ้านโคกสะอาด 
,วัดโชครังสรรค์
,วัดสว่างอัมพา
,วัดภูมิภาค
,วัดอีสาณสามัคคี
,วัดดอนธาตุ
,วัดกุดน้ำเที่ยง
,วัดศิริวัฒนาราม
,วัดถ้ำค้อธรรมาราม
,วัดบ้านหาด
,วัดไตรมิตรสงเคราะห์
,วัดบ้านบก
,วัดชุมแสง
,วัดโพนไพร
,วัดสองคอน
,วัดสระ
,วัดหนองผำ
,วัดซำหวาย
,วัดศิริวรรณ
,วัดป่าจันทราวาส
,วัดป่าหัวดอน
,วัดป่าประชาศรัทธาธรรม
,วัดก้านเหลือง
,วัดโนนตูม
,วัดนรากุมภกาวาส
,วัดช่างหม้อ
,วัดสารภี
,วัดหนองกินเพล
,วัดนาส่วงเหนือ
,วัดแก้งสมบูรณ์
,วัดบ้านสว่าง
,วัดป่าแสนสำราญ
,วัดศนีมงคล
,วัดท่ากกแห่
,วัดอาทิตย์อุทัย
,วัดเชียงแก้ว
,วัดเปือย
,วัดทุ่งบอน
,วัดป่าสุภัททเจดีย์
,วัดโนนจิกน้อย
,วัดสุมานาราม
,วัดสว่างคงคา
,วัดดอนเจริญ
,วัดป่าดงปอ
,วัดอุดมพัฒนา
,วัดจงเจริญ
,วัดโนนรังใหญ่
,วัดหนองซองแมว
,วัดนาไผ่
,วัดป่าเหล่าสูง
,วัดคำผักแว่น
,วัดสว่างพิมพ์ธรรม
,วัดบุบผาราม
,วัดพลแพน
,วัดหนองแฝก
,วัดเวตวันวิทยาราม
,วัดนาพิมาน
,วัดป่าเลา
,วัดสะอาด
,วัดคำหว้า
,วัดประชาสามัคคี
,วัดสร้างเม็ก
,วัดป่าวิเวกศรีเมืองใหม่
,วัดแก่งเจริญทัศน์
,วัดหนองคู
,วัดสวนธรรม
,วัดป่าแสนอุดม
,วัดทุ่งศรีวิไล
,วัดโนนเค็ง
,วัดบ้านค้อ-แขม
,วัดบ้านท่าศาลา(อัมพวันนาราม
,วัดศรีตระการ
,วัดโนนงาม
,วัดหนองมูลเหล็ก
,วัดขัวไม้แก่น
,วัดก่อน้อย
,วัดศรีสมบูรณ์วราราม
,วัดศรีไค
,วัดนาเจริญ(ปทุมพัฒนาราม
,วัดอุดรภาราม
,วัดเรืองบุญ
,วัดหมากมาย
,วัดบ้านเตย
,วัดศรีมงคล
,วัดสวนสวรรค์
,วัดหนองหว้า
,วัดสะพือใต้
,วัดกุญชราราม
,วัดคำสะอาด
,วัดดู่น้อย
,วัดค้อน้อย
,วัดนาหว้า
,วัดแก้งขอ
,วัดบ้านโนน
,วัดนิคมสังฆสามัคคี
,วัดห้วยหมากน้อย
,วัดคำยาง
,วัดนาหนองทุ่ง
,วัดสุขาวาส
,วัดซำงู
,วัดฉิมพลี
,วัดดงยาง
,วัดบ้านบุตร
,วัดบัวเทียม
,วัดนิคมเกษม
,วัดป่าสุธรรมรังษี
,วัดนาเจริญนอก
,วัดนิคมกิตติยาราม
,วัดหัวขัว
,วัดศรีตัสสาราม
,วัดไทรงาม
,วัดไชยมงคล
,วัดรังแร้ง
,วัดรุกขาวาส
,วัดนาฬิกาวาส
,วัดถ้ำเหวสินธุ์ชัย
,วัดสุเนตตาราม
,วัดสมสนุก
,วัดดงบังเหนือ
,วัดวาลุการาม
,วัดนาดอกไม้
,วัดเหล่าแค
,วัดอรุณธราราม
,วัดขามน้อย
,วัดศรีพรหม
,วัดศรีสุนทร
,วัดป่าธรรมโกศล 
,วัดปลาขาว
,วัดป่าพุทโธวาท 
,วัดดงเมย
,วัดหนองแคนพัฒนา
,วัดจันทร์หอม
,วัดป่าดงเย็น
,วัดนาดู่
,วัดคำนาแซง
,วัดนาใต้
,วัดป่าศรีมงคล
,วัดโพนสิม
,วัดภูคำมณี
,วัดหนองมะทอ
,วัดสว่างสมดี
,วัดอวดคงคา
,วัดหนองเหนี่ยว
,วัดสุทัศนาราม
,วัดวุฒิวาส
,วัดมงคลไชยศรี
,วัดป่าน้ำคำเกิ่ง
,วัดสุปัฏนารามวรวิหาร
,วัดบัวยาง
,วัดนาสะตัง
,วัดสว่างสายชล
,วัดฝั่งเพใน
,วัดบ้านบุ่ง
,วัดโพนเมือง
,วัดท่าสนามชัย
,วัดมงคลโกวิทาราม
,วัดเลียบวิสัย
,วัดนาเรือง
,วัดกุดชุม
,วัดหมากแหน่ง
,วัดโนนเปือย
,วัดห้วยสะคาม
,วัดคำหมี
,วัดทุ่งใต้
,วัดบ้านนาคำ
,วัดโกศลนิวาส
,วัดนทีศรัทธาวาส
,วัดป่านาเลิง
,วัดแก้วมงคล
,วัดสว่างวินัย
,วัดสว่างอัมพวัน
,วัดหัวคำ
,วัดบรมคงคา
,วัดสิงหาร
,วัดป่าไทรงาม
,วัดลัฏฐยาวาส
,วัดสระเมือง
,วัดปลาดุก
,วัดศรีสว่างวนาราม
,วัดทุ่งหนองพอก
,วัดป่าวิเวก
,วัดโนนหลี่
,วัดบ้านหวาง
,วัดดูน
,วัดธาตุรังษี
,วัดหนองโดน
,วัดสำโรงใต้
,วัดโนนฮาง
,วัดตาโกย
,วัดมงคลนอก
,วัดบ้านหนองหว้า
,วัดป่าโพธิศรี
,วัดจิกสูง
,วัดคำสว่าง
,วัดโพธิ์ศรีเหนือ
,วัดยางกลาง
,วัดหนองเม็ก
,วัดภูไทพัฒนา
,วัดสว่างวนาราม
,วัดบูรพาราม
,วัดหนองห้าง
,วัดอัมพวัน
,วัดดอนหวาย
,วัดนาเจริญ
,วัดโคกใหญ่
,วัดธชาวาส
,วัดระเว
,วัดคำเขื่อนแก้ว
,วัดฉันทาราม
,วัดหนองหิน
,วัดนาตาหมุด
,วัดสุวรรณาราม
,วัดสร้างแก้วเหนือ
,วัดอภัยคีรี
,วัดบ้านธาตุ
,วัดมูลผลาวาส
,วัดทุ่งเทิง
,วัดบ้านท่าลาด
,วัดบ้งมั่ง
,วัดหาดสวนยา 
,วัดบัวขาว
,วัดหนองกุงน้อย
,วัดโพธิ์ศรีใต้
,วัดใหม่สำราญรมย์
,วัดป่าเทพนิมิตร 
,วัดดุสิตาราม
,วัดบ้านผำ
,วัดวังกางฮุง
,วัดหินสูง
,วัดยางใหญ่
,วัดสุวรรณวงศาราม
,วัดสร้างแก้ว
,วัดสนามชัย
,วัดถ้ำเต่า
,วัดห้วยกว้าง
,วัดเรียบปะอาวใต้(ปะอาวใต้
,วัดโนนจิก
,วัดกุดหวาย
,วัดกุดประทาย
,วัดหนองฮาง
,วัดสารพัดนึก
,วัดป่งคอมสามัคคี
,วัดกุดกั่ว
,วัดบุเปือย
,วัดนาโพธิ์น้อย
,วัดหนองป่าพง
,วัดกลางน้อย
,วัดมะเขือ
,วัดโนนยาง
,วัดอาเลา
,วัดมหาวนาราม
,วัดคำข่า
,วัดห้วยชันเหนือ
,วัดบ้านยางเทิง
,วัดศรีไสยาวาส
,วัดธรรมรังษี
,วัดป่ามงคล
,วัดปลาฝา
,วัดร่องหมู
,วัดโนนสมบูรณ์
,วัดป่าภูกระต่าย
,วัดป่า
,วัดหนองบัวอารีย์
,วัดนาซาว
,วัดโนนแคน
,วัดท่าศิลา
,วัดส้มป่อย
,วัดทุ่งเกษม
,วัดศรีคุณเมือง
,วัดทุ่งสว่าง
,วัดขนวน
,วัดสว่างวงค์
,วัดใต้ยางขี้นก
,วัดหนองแสง
,วัดหัวดอน
,วัดสุขเกษม
,วัดค้อ
,วัดเหล่าคำ
,วัดโกศรีวนาราม
,วัดหนองควายน้อย
,วัดนาประชุม
,วัดศรีบูรพา
,วัดโคกก่อง
,วัดเกาะแก้วคูณดี
,วัดโนนสว่าง
,วัดเลียบมงคล
,วัดบ้านหนองหอย
,วัดหัวดูน
,วัดดอนชี
,วัดบ้านโพธิ์มูล
,วัดศรีชมภู
,วัดตาโอง
,วัดศรีสุมังค์
,วัดหนองแปก
,วัดเป้าหัวทุ่ง
,วัดนายูง
,วัดป่าโนนคำดูลวนาราม
,วัดนาหว้า(ภาราวาส
,วัดน้ำขุ่น
,วัดหนองดุม
,วัดน้ำคำน้อย
,วัดนามน
,วัดสระแก้วรังษี
,วัดเจริญทัศน์
,วัดส้มเสี้ยว
,วัดนาศรีนวล
,วัดศรีสุมังคลาราม
,วัดแก่งดูกใส
,วัดบัวแดง
,วัดดงบังใต้
,วัดชัยอุดม
,วัดเมตตาราม
,วัดหนองสนม
,วัดป่าดงใหญ่
,วัดบุรีรมย์
,วัดแสนชะนี
,วัดโพนสูง
,วัดโขงเจียม
,วัดสร้างสะแบง
,วัดสร้างมิ่ง
,วัดนาเจริญใน
,วัดดงไม้งาม
,วัดหนองแต้
,วัดปทุมมาลัย
,วัดป่าถ้ำค้อ
,วัดยางธาตุ
,วัดแขมใต้(บ้านแขมใต้
,วัดป่าโนนสูงสุปัฎนาราม
,วัดบ้านวังถ้ำ
,วัดศรีโพธิ์
,วัดบ้านนาผาย(นาผาย
,วัดบัวงาม
,วัดแก่งศิลา
,วัดบ้านภูทอง
,วัดตำแย
,วัดศิริมงคล
,วัดห้วยเสลา
,วัดบ้านโอด
,วัดกุดเรือ
,วัดคำหนามแท่ง
,วัดหนองมะนาว
,วัดท่าหลวง
,วัดป่าเกษตร
,วัดศรีบัวไข
,วัดคำขวาง
,วัดทุ่งหนองบัว
,วัดนอก
,วัดคันธวารี
,วัดกุดเรือคำ
,วัดร่องสมบูรณ์
,วัดม่วงสามสิบ
,วัดสว่าง
,วัดป่าโพนพระ
,วัดสามัคคีชัย(ป่าสามัคคีชัย
,วัดศรีเชียงใหม่
,วัดหนองกุงใหญ่(สระปทุมมาลัย
,วัดโคกเซบูรณ์สามัคคี
,วัดธาตุลุ่ม(เจริญชัย
,วัดอินทาราม
,วัดสว่างอารุณ
,วัดดอนยาว
,วัดศรีสุการาม
,วัดหนองโน
,วัดศรีโพธิ์ชัย
,วัดมิ่งมงคล
,วัดสายคำ
,วัดปากกุดหวาย
,วัดป่าก่อ
,วัดหนองจำนัก
,วัดศรีเมืองใหม่
,วัดแขมเจริญ
,วัดทุ่งกว้าง
,วัดหนองจาน
,วัดโนนสะอาด
,วัดโนนสวน
,วัดกุดปลาขาว
,วัดมณีจันทร์
,วัดโพธิ์ตาก
,วัดทับไฮ(บ้านทับไฮ
,วัดแสงอุทัย
,วัดโนนทรัพย์
,วัดปะอาวเหนือ
,วัดสวนงัว
,วัดน้ำเที่ยง
,วัดกิตติราชเจริญศรี
,วัดโนนจันทร์
,วัดบ้านแดง
,วัดดอนกลาง
,วัดบ้านไผ่
,วัดพระโต
,วัดจังกาจิตต์
,วัดสมพรรัตนาราม
,วัดรัตนสามัคคี
,วัดโนนโพธิ์
,วัดอรุณวนาราม
,วัดบ้านโนนมะเขือ
,วัดโพธิ์ไทร
,วัดดอนขวาง
,วัดโคกสว่าง
,วัดหนองเค็ง
,วัดโนนสวรรค์
,วัดแดงหม้อ
,วัดบ้านโนนจิก
,วัดค้อโคน
,วัดแก้งกกไฮ
,วัดหนองมง
,วัดราษฎร์ประดิษฐ์
,วัดเกษมสำราญ
,วัดยางน้อย
,วัดศรีจุมพลโนนใหญ่
,วัดศรีโพธิ์ไทร
,วัดภูอานนท์
,วัดแก่งจุการ
,วัดคำสมอ
,วัดป่าโมงใหญ่
,วัดห้วยปอ
,วัดราชวงศาราม
,วัดห้วยยาง
,วัดบกมันแกว
,วัดศรีอุดร
,วัดมดง่าม
,วัดศรีสุพนอาราม
,วัดหนองโด
,วัดค้อใต้
,วัดบุ่งหวาย
,วัดโชติการาม
,วัดบ้านบุ่งซวย
,วัดสังฆระเวกกุลสิงห์
,วัดกุดอุดมสมบูรณ์
,วัดน้ำเกลี้ยง
,วัดนาประดู่
